<?xml version="1.0" encoding="UTF-8"?>
<Guess-Market  xmlns:xsi="http://www.w3.org/2001/XMLSchema-instance" xsi:noNamespaceSchemaLocation="GM-EX2-Schema.xsd">
	<GM-events>
		<GM-event name="Mujtaba is Dead">
			<id>1</id>
			<description>This event gambles if Mujtaba is a live or not. it will be determined if he will be shown in public until 31.8.26</description>
			<commission action="on-purchase">5</commission>
			<GM-options>
				<GM-option>Hell Yea !</GM-option>
				<GM-option>No way !</GM-option>
			</GM-options>
			<GM-method>
				<GM-LMSR>
					<b>100</b>
				</GM-LMSR>
			</GM-method>
		</GM-event>
		<GM-event name="World Cap Winner">
			<id>2</id>
			<description>Who do you think will win the world cap ?</description>
			<commission action="on-close">15</commission>
			<GM-options>
				<GM-option>Argentina</GM-option>
				<GM-option>Spain</GM-option>
			</GM-options>
			<GM-method>
				<GM-order-book allow-mint="true" initial="100" d="1"/>
			</GM-method>
		</GM-event>
	</GM-events>
	<GM-users>
		<GM-user name="Avrum">
			<initial-cash>1000</initial-cash>
			<GM-market-maker>
				<event id="2"/>
			</GM-market-maker>
		</GM-user>
		<GM-user name="Tikva">
			<initial-cash>10000</initial-cash>
			<GM-market-maker>
				<event id="1"/>
			</GM-market-maker>
		</GM-user>
		<GM-user name="Menash">
			<initial-cash>100</initial-cash>
		</GM-user>
	</GM-users>
</Guess-Market>
